{
  "schemaVersion": 1,
  "name": "Upper Lower",
  "defaultRestSeconds": 90,
  "schedule": "rotation",
  "cycle": ["Upper A", "Lower A", "rest", "Upper B", "Lower B", "rest", "rest"],
  "days": [
    {
      "name": "Upper A",
      "exercises": [
        {
          "name": "Barbell Bench Press",
          "sets": 4,
          "reps": "6-8",
          "restSeconds": 150,
          "notes": "Start light. When every set reaches 8 the app will tell you to add weight. Feet flat, shoulder blades pinched, bar to the lower chest."
        },
        {
          "name": "Barbell Row",
          "sets": 4,
          "reps": "6-8",
          "restSeconds": 120,
          "notes": "Hinge to about 45 degrees, pull the bar to the lower ribs, lower under control."
        },
        {
          "name": "Dumbbell Shoulder Press",
          "sets": 3,
          "reps": "8-12",
          "restSeconds": 90,
          "notes": "Elbows a little forward, press to lockout without leaning back."
        },
        {
          "name": "Lat Pulldown",
          "sets": 3,
          "reps": "10-12",
          "restSeconds": 90,
          "notes": "Chest up, pull to the collarbones, control the way back."
        },
        {
          "name": "Dumbbell Curl",
          "group": "A",
          "sets": 3,
          "reps": "10-12",
          "restSeconds": 60,
          "notes": "Superset with the pushdowns: one after the other, then rest."
        },
        {
          "name": "Tricep Pushdown",
          "group": "A",
          "sets": 3,
          "reps": "10-12",
          "restSeconds": 60,
          "notes": "Elbows pinned to the sides; only the forearms move."
        }
      ]
    },
    {
      "name": "Lower A",
      "exercises": [
        {
          "name": "Barbell Back Squat",
          "sets": 4,
          "reps": "6-8",
          "restSeconds": 180,
          "notes": "Bar on the upper back, big breath, sit down between the knees, drive the floor away."
        },
        {
          "name": "Romanian Deadlift",
          "sets": 3,
          "reps": "8-10",
          "restSeconds": 120,
          "notes": "Soft knees, push the hips back until the hamstrings pull, bar close to the legs the whole way."
        },
        {
          "name": "Leg Press",
          "sets": 3,
          "reps": "10-12",
          "restSeconds": 90,
          "notes": "Feet shoulder width, lower until the thighs pass parallel, never lock the knees hard."
        },
        {
          "name": "Leg Curl",
          "group": "A",
          "sets": 3,
          "reps": "10-12",
          "restSeconds": 60,
          "notes": "Superset with the calf raises. Squeeze at the top, lower slowly."
        },
        {
          "name": "Standing Calf Raise",
          "group": "A",
          "sets": 3,
          "reps": "12-15",
          "restSeconds": 60,
          "notes": "Pause at the bottom stretch and at the top."
        },
        {
          "name": "Plank",
          "sets": 3,
          "durationSeconds": 45,
          "warningBeep": true,
          "bodyweight": true,
          "restSeconds": 45,
          "notes": "Elbows under the shoulders, squeeze the glutes, one straight line."
        }
      ]
    },
    {
      "name": "Upper B",
      "exercises": [
        {
          "name": "Overhead Press",
          "sets": 4,
          "reps": "6-8",
          "restSeconds": 150,
          "notes": "Bar at the collarbones, squeeze the glutes, press straight up and move the head through at the top."
        },
        {
          "name": "Pull-Up",
          "sets": 3,
          "reps": "6-10",
          "bodyweight": true,
          "restSeconds": 120,
          "notes": "Use a band or the assisted machine if 6 is out of reach; hang a weight from a belt once 10 is easy."
        },
        {
          "name": "Incline Dumbbell Press",
          "sets": 3,
          "reps": "8-12",
          "restSeconds": 90,
          "notes": "Bench at about 30 degrees. Lower until the elbows are level with the shoulders."
        },
        {
          "name": "Seated Cable Row",
          "sets": 3,
          "reps": "10-12",
          "restSeconds": 90,
          "notes": "Chest up, pull to the lower ribs, let the shoulder blades reach forward between reps."
        },
        {
          "name": "Lateral Raise",
          "group": "A",
          "sets": 3,
          "reps": "12-15",
          "restSeconds": 60,
          "notes": "Superset with the face pulls. Lead with the elbows, stop at shoulder height."
        },
        {
          "name": "Face Pull",
          "group": "A",
          "sets": 3,
          "reps": "12-15",
          "restSeconds": 60,
          "notes": "Cable or band at face height. Pull to the ears with the elbows high."
        }
      ]
    },
    {
      "name": "Lower B",
      "exercises": [
        {
          "name": "Deadlift",
          "sets": 3,
          "reps": "4-6",
          "restSeconds": 180,
          "notes": "Bar over mid-foot, hips high enough to keep the back flat, push the floor away. Reset every rep."
        },
        {
          "name": "Bulgarian Split Squat",
          "sets": 3,
          "reps": "8-10",
          "restSeconds": 120,
          "notes": "8 to 10 each leg, rear foot on a bench. Dumbbells in the hands once bodyweight is easy."
        },
        {
          "name": "Hip Thrust",
          "sets": 3,
          "reps": "8-12",
          "restSeconds": 90,
          "notes": "Upper back on a bench, chin tucked, drive the hips up and squeeze for a second at the top."
        },
        {
          "name": "Leg Extension",
          "sets": 3,
          "reps": "12-15",
          "restSeconds": 60,
          "notes": "Pause at the top; do not swing the weight up."
        },
        {
          "name": "Hanging Knee Raise",
          "sets": 3,
          "reps": "10-15",
          "bodyweight": true,
          "restSeconds": 60,
          "notes": "Curl the pelvis up rather than just lifting the knees. No bar? Lying leg raises."
        }
      ]
    }
  ]
}
