{
  "schemaVersion": 1,
  "name": "Push Pull Legs",
  "defaultRestSeconds": 90,
  "schedule": "rotation",
  "cycle": ["Push", "Pull", "Legs", "Push", "Pull", "Legs", "rest"],
  "days": [
    {
      "name": "Push",
      "exercises": [
        {
          "name": "Barbell Bench Press",
          "sets": 4,
          "reps": "6-8",
          "restSeconds": 150,
          "notes": "No weights are filled in. Start light, type what you lift on the first set, and the app remembers it from then on; when every set reaches 8 it will tell you to add weight. Feet flat, shoulder blades pinched, bar to the lower chest."
        },
        {
          "name": "Overhead Press",
          "sets": 3,
          "reps": "8-10",
          "restSeconds": 120,
          "notes": "Bar at the collarbones, squeeze the glutes, press straight up and move the head through at the top."
        },
        {
          "name": "Incline Dumbbell Press",
          "sets": 3,
          "reps": "8-12",
          "restSeconds": 90,
          "notes": "Bench at about 30 degrees. Lower until the elbows are level with the shoulders."
        },
        {
          "name": "Lateral Raise",
          "group": "A",
          "sets": 3,
          "reps": "12-15",
          "restSeconds": 60,
          "notes": "Superset with the pushdowns: one after the other, then rest. Lead with the elbows, stop at shoulder height."
        },
        {
          "name": "Tricep Pushdown",
          "group": "A",
          "sets": 3,
          "reps": "10-12",
          "restSeconds": 60,
          "notes": "Elbows pinned to the sides; only the forearms move."
        },
        {
          "name": "Overhead Tricep Extension",
          "sets": 3,
          "reps": "10-12",
          "restSeconds": 60,
          "notes": "One dumbbell in both hands behind the head. Elbows point forward, not out."
        }
      ]
    },
    {
      "name": "Pull",
      "exercises": [
        {
          "name": "Deadlift",
          "sets": 3,
          "reps": "4-6",
          "restSeconds": 180,
          "notes": "Bar over mid-foot, hips high enough to keep the back flat, push the floor away. Reset every rep. Two heavy pulls a week too much? On the second Pull day, tap the exercise's menu and Change exercise to Barbell Row."
        },
        {
          "name": "Pull-Up",
          "sets": 3,
          "reps": "6-10",
          "bodyweight": true,
          "restSeconds": 120,
          "notes": "Use a band or the assisted machine if 6 is out of reach; hang a weight from a belt once 10 is easy."
        },
        {
          "name": "Seated Cable Row",
          "sets": 3,
          "reps": "10-12",
          "restSeconds": 90,
          "notes": "Chest up, pull to the lower ribs, let the shoulder blades reach forward between reps."
        },
        {
          "name": "Face Pull",
          "group": "A",
          "sets": 3,
          "reps": "12-15",
          "restSeconds": 60,
          "notes": "Superset with the curls. Cable or band at face height, pull to the ears with the elbows high."
        },
        {
          "name": "Dumbbell Curl",
          "group": "A",
          "sets": 3,
          "reps": "10-12",
          "restSeconds": 60,
          "notes": "Elbows still, full stretch at the bottom."
        },
        {
          "name": "Hammer Curl",
          "sets": 3,
          "reps": "10-12",
          "restSeconds": 60,
          "notes": "Palms facing each other the whole way."
        }
      ]
    },
    {
      "name": "Legs",
      "exercises": [
        {
          "name": "Barbell Back Squat",
          "sets": 4,
          "reps": "6-8",
          "restSeconds": 180,
          "notes": "Bar on the upper back, big breath, sit down between the knees, drive the floor away."
        },
        {
          "name": "Romanian Deadlift",
          "sets": 3,
          "reps": "8-10",
          "restSeconds": 120,
          "notes": "Soft knees, push the hips back until the hamstrings pull, bar close to the legs the whole way."
        },
        {
          "name": "Leg Press",
          "sets": 3,
          "reps": "10-12",
          "restSeconds": 90,
          "notes": "Feet shoulder width, lower until the thighs pass parallel, never lock the knees hard."
        },
        {
          "name": "Leg Curl",
          "group": "A",
          "sets": 3,
          "reps": "10-12",
          "restSeconds": 60,
          "notes": "Superset with the calf raises. Squeeze at the top, lower slowly."
        },
        {
          "name": "Standing Calf Raise",
          "group": "A",
          "sets": 3,
          "reps": "12-15",
          "restSeconds": 60,
          "notes": "Pause at the bottom stretch and at the top."
        },
        {
          "name": "Hanging Knee Raise",
          "sets": 3,
          "reps": "10-15",
          "bodyweight": true,
          "restSeconds": 60,
          "notes": "Curl the pelvis up rather than just lifting the knees. No bar? Lying leg raises."
        }
      ]
    }
  ]
}
