{
  "name": "Walk",
  "defaultRestSeconds": 60,
  "restBetweenExercises": 90,
  "days": [
    {
      "name": "A",
      "exercises": [
        {
          "name": "Barbell Row",
          "sets": 2,
          "reps": "8-10",
          "weight": 60
        },
        {
          "name": "Dumbbell Curl",
          "sets": 2,
          "reps": "10-12",
          "weight": 12
        }
      ]
    }
  ]
}
